"Agency","federal_account_code","Account_Name","Percent_Outlaid","Percent_Obligated_Not_Outlaid","Percent_Unobligated","Amount_Outlaid","Amount_Obligated","Amount_Unobligated","Total_Budgetary_Resources","Loan_Program_Account"
"Other Agencies","080-0122","Safety, Security and Missions Services, National Aeronautics and Space Administration",0.5,10.4,89.1,310995.09,6572933.74,53427066.26,60000000,"No"
"Other Agencies","096-3123","Operation and Maintenance, Corps of Engineers-Civil",1.9,0.2,97.9,936783.41,1019372.09,48980627.91,50000000,"No"
"Other Agencies","474-0301","Office of Museum and Library Services: Grants and Administration, Institute of Museum and Library Services ",0,60,40,0,30025000,19975000,50000000,"No"
"Other Agencies","033-0302","Operations and Maintenance, John F. Kennedy Center for the Performing Arts",0,92,8,0,23000000,2000000,25000000,"No"
"Other Agencies","005-0107","Salaries and Expenses, Government Accountability Office",0.2,0,99.8,41213.66,41213.66,19958786.34,20000000,"No"
"Other Agencies","096-3124","Expenses, Corps of Engineers-Civil",0.6,1.7,97.7,116537.72,457088.06,19542911.94,20000000,"No"
"Other Agencies","024-0100","Salaries and Expenses, Office of Personnel Management",0,0,100,0,0,12100000,12100000,"No"
"Other Agencies","088-0300","Operating Expenses, National Archives and Records Administration",0,31.1,68.9,0,2520010.56,5579989.44,8100000,"No"
"Other Agencies","033-0100","Salaries and Expenses, Smithsonian Institution",7.3,19.8,72.9,549192.63,2031804.9,5468195.1,7500000,"No"
"Other Agencies","049-0106","Education and Human Resources, National Science Foundation",0,62.9,37.1,0,3143013,1856987,5000000,"No"
"Other Agencies","068-0108","Environmental Programs and Management, Environmental Protection Agency",4.6,0,95.4,180000,180000,3730000,3910000,"No"
"Other Agencies","031-0200","Salaries and Expenses, Nuclear Regulatory Commission",0,8.2,91.8,0,270600,3029400,3300000,"No"
"Other Agencies","084-8522","Armed Forces Retirement Home Trust Fund, Armed Forces Retirement Home",0,2,98,0,56880,2743120,2800000,"No"
"Other Agencies","068-0107","Science and Technology, Environmental Protection Agency",0,0,100,0,0,2250000,2250000,"No"
"Other Agencies","049-0180","Agency Operations and Award Management, National Science Foundation",0,0,100,0,0,1000000,1000000,"No"
"Other Agencies","068-0110","Buildings and Facilities, Environmental Protection Agency ",0,0,100,0,0,300000,300000,"No"
"Other Agencies","373-2900","Payment to the Institute, Institute of American Indian and Alaska Native Culture and Arts Development",100,0,0,78000,78000,0,78000,"No"
"Railroad Retirement Board","060-0117","Railroad Unemployment Insurance Extended Benefits Payments, Railroad Retirement Board",0,3.3,96.7,0,4407792.2,129009030,133416822.2,"No"
"Railroad Retirement Board","060-8237","Limitation on Administration, Railroad Retirement Board",0,0,100,0,0,5000000,5000000,"No"
"Small Business Administration","073-1154","Business Loans Program Account, Small Business Administration",1.1,66.6,32.3,7824042809,465733671804.28,221601328195.72,687335000000,"Yes"
"Small Business Administration","073-1152","Disaster Loans Program Account, Small Business Administration",0,0.1,99.9,12211201.68,71976388.2,49928023611.8,50000000000,"Yes"
"Small Business Administration","073-0500","Emergency EIDL Grants, Small Business Administration",66.6,10.2,23.2,6657762000,7680117000,2319883000,10000000000,"No"
"Small Business Administration","073-0100","Salaries and Expenses, Small Business Administration",0.1,7.8,92.1,1166582.55,218063843.04,2556936156.96,2775000000,"No"
"Small Business Administration","073-0400","Entrepreneurial Development Programs, Small Business Administration",0,31.6,68.4,0,83758567.92,181241432.08,265000000,"No"
"Social Security Admin.","028-8704","Salaries and Expenses, Social Security Administration",0,3,97,0,10258610.57,327741389.43,338000000,"No"
